tweet_id,timestamp_datetime,text,dog_name,rating_avg,source_text,expanded_urls,favorite_count,retweet_count,rank
831670449226514432,2017-02-15 01:04:21,This is Daisy. She has a heart on her butt. 13/10 topical af https://t.co/u6p4LxzHKg,Daisy,13.0,Twitter for iPhone,https://twitter.com/dog_rates/status/831670449226514432/photo/1,11439.0,2053.0,
831650051525054464,2017-02-14 23:43:18,"I usually only share these on Friday's, but this is Blue. He's a very smoochable pooch who needs your help. 13/10

https://t.co/piiX0ke8Z6 https://t.co/1UHrKcaCiO",,13.0,Twitter for iPhone,"http://www.gofundme.com/bluethewhitehusky,https://twitter.com/dog_rates/status/831650051525054464/photo/1",7868.0,2226.0,
831552930092285952,2017-02-14 17:17:22,This is Dutch. He dressed up as his favorite emoji for Valentine's Day. I've got heart eyes for his heart eyes. 13/10 https://t.co/BCbmFYLrse,Dutch,13.0,Twitter for iPhone,https://twitter.com/dog_rates/status/831552930092285952/photo/1,9843.0,2620.0,
831322785565769729,2017-02-14 02:02:51,This is Pete. He has no eyes. Needs a guide doggo. Also appears to be considerably fluffy af. 12/10 would hug softly https://t.co/Xc0gyovCtK,Pete,12.0,Twitter for iPhone,https://twitter.com/dog_rates/status/831322785565769729/photo/1,,,doggo
831315979191906304,2017-02-14 01:35:49,I couldn't make it to the #WKCDogShow BUT I have people there on the ground relaying me the finest pupper pics possible. 13/10 for all https://t.co/jd6lYhfdH4,,13.0,Twitter Web Client,https://twitter.com/dog_rates/status/831315979191906304/photo/1,7087.0,1261.0,pupper
831309418084069378,2017-02-14 01:09:44,This is Scooter and his son Montoya.  Scooter is a wonderful father. He takes very good care of Montoya. Both 12/10 would pet at same time https://t.co/ghqMfxxa4V,Scooter,12.0,Twitter for iPhone,https://twitter.com/dog_rates/status/831309418084069378/photo/1,,,
831262627380748289,2017-02-13 22:03:49,This is Tucker. He's feeling h*ckin festive and his owners don't have the heart to tell him Christmas is over. 12/10 https://t.co/zqR5XKMpuY,Tucker,12.0,Twitter for iPhone,https://twitter.com/dog_rates/status/831262627380748289/photo/1,,,
830956169170665475,2017-02-13 01:46:03,Say hello to Reggie. He hates puns. 12/10 lighten pup Reggie https://t.co/X4vNEzAod5,Reggie,12.0,Twitter for iPhone,https://twitter.com/dog_rates/status/830956169170665475/video/1,,,
830583320585068544,2017-02-12 01:04:29,This is Lilly. She just parallel barked. Kindly requests a reward now. 13/10 would pet so well https://t.co/SATN4If5H5,Lilly,13.0,Twitter for iPhone,https://twitter.com/dog_rates/status/830583320585068544/photo/1,73157.0,19188.0,
830097400375152640,2017-02-10 16:53:37,"Meet Samson. He's absolute fluffy perfection. Easily 13/10, but he needs your help. Click the link to find out more

https://t.co/z82hCtwhpn https://t.co/KoWrMkbMbW",Samson,13.0,Twitter for iPhone,"https://www.gofundme.com/sick-baby-samson,https://twitter.com/dog_rates/status/830097400375152640/photo/1",10769.0,3441.0,
829861396166877184,2017-02-10 01:15:49,This is Mia. She already knows she's a good dog. You don't have to tell her. 12/10 would probably tell her anyway https://t.co/xeudgDXmTU,Mia,12.0,Twitter for iPhone,https://twitter.com/dog_rates/status/829861396166877184/photo/1,13402.0,2234.0,
829501995190984704,2017-02-09 01:27:41,This is Leo. He was a skater pup. She said see ya later pup. He wasn't good enough for her. 12/10 you're good enough for me Leo https://t.co/Xw9JbJHTul,Leo,12.0,Twitter for iPhone,https://twitter.com/dog_rates/status/829501995190984704/photo/1,34779.0,12146.0,
829449946868879360,2017-02-08 22:00:52,Here's a stressed doggo. Had a long day. Many things on her mind. The hat communicates these feelings exquisitely. 11/10 https://t.co/fmRS43mWQB,,11.0,Twitter for iPhone,https://twitter.com/dog_rates/status/829449946868879360/photo/1,11484.0,2319.0,doggo
829374341691346946,2017-02-08 17:00:26,This is Astrid. She's a guide doggo in training. 13/10 would follow anywhere https://t.co/xo7FZFIAao,Astrid,13.0,Twitter for iPhone,https://twitter.com/dog_rates/status/829374341691346946/photo/1,,,doggo
829141528400556032,2017-02-08 01:35:19,This is Malcolm. He goes from sneaky tongue slip to flirt wink city in a matter of seconds. 12/10 would hug softly https://t.co/rHwfySggqR,Malcolm,12.0,Twitter for iPhone,https://twitter.com/dog_rates/status/829141528400556032/photo/1,26859.0,8486.0,
829011960981237760,2017-02-07 17:00:28,This is Dexter. He was reunited with his mom yesterday after she was stuck in Iran during the travel Bannon. 13/10 welcome home https://t.co/U50RlRw4is,Dexter,13.0,Twitter for iPhone,https://twitter.com/dog_rates/status/829011960981237760/photo/1,58067.0,18527.0,
828770345708580865,2017-02-07 01:00:22,This is Alfie. He's your Lyft for tonight. Kindly requests you buckle pup and remain reasonably calm during the ride. 13/10 he must focus https://t.co/AqPTHYUBFz,Alfie,13.0,Twitter for iPhone,https://twitter.com/dog_rates/status/828770345708580865/photo/1,,,
828650029636317184,2017-02-06 17:02:17,"Occasionally, we're sent fantastic stories. This is one of them. 14/10 for Grace https://t.co/bZ4axuH6OK",,14.0,Twitter for iPhone,https://twitter.com/dog_rates/status/828650029636317184/photo/1,10437.0,1540.0,
828409743546925057,2017-02-06 01:07:28,This is Mutt Ryan. He's quite confident at the moment. 12/10 rise pup! https://t.co/ZH5CvRlCxt,Mutt,12.0,Twitter for iPhone,https://twitter.com/dog_rates/status/828409743546925057/photo/1,,,
828408677031882754,2017-02-06 01:03:14,This is Bear. He went outside to play in the snow. Needed a break from the game. Feeling a tad better now. 12/10  deep breaths Bear https://t.co/7WFLKli2T3,Bear,12.0,Twitter for iPhone,https://twitter.com/dog_rates/status/828408677031882754/photo/1,,,
828381636999917570,2017-02-05 23:15:47,Meet Doobert. He's a deaf doggo. Didn't stop him on the field tho. Absolute legend today. 14/10 would pat head approvingly https://t.co/iCk7zstRA9,Doobert,14.0,Twitter for iPhone,https://twitter.com/dog_rates/status/828381636999917570/photo/1,,,doggo
828376505180889089,2017-02-05 22:55:23,"This is Beebop. Her name means ""Good Dog"" in robot. She also was a star on the field today. 13/10 would pet well https://t.co/HKBVZqXFNR",Beebop,13.0,Twitter for iPhone,https://twitter.com/dog_rates/status/828376505180889089/photo/1,,,
828372645993398273,2017-02-05 22:40:03,This is Alexander Hamilpup. He was one of the many stars in this year's Puppy Bowl. He just hopes both teams had fun. 12/10 https://t.co/JcTuUcyYNS,Alexander,12.0,Twitter for iPhone,https://twitter.com/dog_rates/status/828372645993398273/photo/1,,,
828046555563323392,2017-02-05 01:04:17,This is Sailer. He waits on the roof for his owners to come home. Nobody knows how he gets up there. H*ckin loyal af. 13/10 https://t.co/O37z4jaMG9,Sailer,13.0,Twitter for iPhone,https://twitter.com/dog_rates/status/828046555563323392/photo/1,12887.0,3245.0,
828011680017821696,2017-02-04 22:45:42,Say hello to Brutus and Jersey. They think they're the same size. Best furiends furever. Both 11/10 would pet simultaneously https://t.co/rkhCFfDtxB,Brutus,11.0,Twitter for iPhone,https://twitter.com/dog_rates/status/828011680017821696/photo/1,11364.0,2441.0,
827933404142436356,2017-02-04 17:34:40,This is Kona. Yesterday she stopped by the department to see what it takes to be a police pupper. 12/10 vest was only a smidge too big https://t.co/j8D3PQJvpJ,Kona,12.0,Twitter for iPhone,https://twitter.com/dog_rates/status/827933404142436356/photo/1,,,pupper
827653905312006145,2017-02-03 23:04:02,This is Boots. She doesn't know what to do with treats so she just holds them. Very good girl. 12/10 would give more treats https://t.co/eAA8lratd3,Boots,12.0,Twitter for iPhone,https://twitter.com/dog_rates/status/827653905312006145/photo/1,,,
827600520311402496,2017-02-03 19:31:54,Meet Tucker. It's his birthday. He's pupset with you because you're too busy playing @GoodDogsGame to celebrate. 13/10 would put down phone https://t.co/vrppizPGdb,Tucker,13.0,Twitter for iPhone,https://twitter.com/dog_rates/status/827600520311402496/photo/1,8125.0,1080.0,
827324948884643840,2017-02-03 01:16:53,"This is Ralphie. He's being treated for an overactive funny bone, which is no joke. 12/10 would try to pet with a straight face https://t.co/UU3KqQF5n5",Ralphie,12.0,Twitter for iPhone,https://twitter.com/dog_rates/status/827324948884643840/photo/1,17444.0,3490.0,
827199976799354881,2017-02-02 17:00:17,This is Charlie. He wins every game of chess he plays. Won't let opponent pet him until they forfeit. 13/10 you win again Charlie https://t.co/UkyQibIBzZ,Charlie,13.0,Twitter for iPhone,https://twitter.com/dog_rates/status/827199976799354881/photo/1,,,
826958653328592898,2017-02-02 01:01:21,This is Loki. He smiles like Elvis. Ain't nothin but a hound doggo. 12/10 https://t.co/QV5nx6otZR,Loki,12.0,Twitter for iPhone,https://twitter.com/dog_rates/status/826958653328592898/photo/1,,,doggo
826848821049180160,2017-02-01 17:44:55,This is Cupid. He was found in the trash. Now he's well on his way to prosthetic front legs and a long happy doggo life. 13/10 heroic af https://t.co/WS0Gha8vRh,Cupid,13.0,Twitter for iPhone,https://twitter.com/dog_rates/status/826848821049180160/photo/1,40170.0,11805.0,doggo
826598365270007810,2017-02-01 01:09:42,This is Pawnd... James Pawnd. He's suave af. 13/10 would trust with my life https://t.co/YprN62Z74I,Pawnd,13.0,Twitter for iPhone,https://twitter.com/dog_rates/status/826598365270007810/photo/1,,,
826476773533745153,2017-01-31 17:06:32,This is Pilot. He has mastered the synchronized head tilt and sneaky tongue slip. Usually not unlocked until later doggo days. 12/10 https://t.co/YIV8sw8xkh,Pilot,12.0,Twitter for iPhone,https://twitter.com/dog_rates/status/826476773533745153/photo/1,,,doggo
826240494070030336,2017-01-31 01:27:39,We only rate dogs. Please don't send in any more non-dogs like this Wild Albanian Street Moose. Thank you... 11/10 https://t.co/srXL2s868C,,11.0,Twitter for iPhone,https://twitter.com/dog_rates/status/826240494070030336/photo/1,14564.0,2957.0,
826204788643753985,2017-01-30 23:05:46,"Here's a little more info on Dew, your favorite roaming doggo that went h*ckin viral. 13/10 
https://t.co/1httNYrCeW https://t.co/KvaM8j3jhX",,13.0,Twitter for iPhone,"http://us.blastingnews.com/news/2017/01/kentucky-teen-helps-lost-yellow-labrador-and-gets-a-huge-surprise-001431969.html?sbdht=_pM1QUzk3wsenGU1giO7UnJ5NGGiKRW9AD5xs2MkaDpYY13JxbtKE4w2_,https://twitter.com/dog_rates/status/826204788643753985/photo/1",,,doggo
826115272272650244,2017-01-30 17:10:04,This is Ike. He's demonstrating the pupmost restraint. 13/10 super good boy https://t.co/6gHoGah9nm,Ike,13.0,Twitter for iPhone,https://twitter.com/dog_rates/status/826115272272650244/photo/1,,,
825876512159186944,2017-01-30 01:21:19,This is Mo. No one will push him around in the grocery cart. He's quite pupset about it. 11/10 I volunteer https://t.co/feNwTq12S5,,11.0,Twitter for iPhone,https://twitter.com/dog_rates/status/825876512159186944/photo/1,11481.0,2138.0,
825829644528148480,2017-01-29 22:15:05,This is Toby. He just found out you only pretend to throw the ball sometimes. H*ckin puppalled. 12/10 would console https://t.co/YimNdkZrhM,Toby,12.0,Twitter for iPhone,https://twitter.com/dog_rates/status/825829644528148480/photo/1,13974.0,2837.0,
825535076884762624,2017-01-29 02:44:34,Here's a very loving and accepting puppo. Appears to have read her Constitution well. 14/10 would pat head approvingly https://t.co/6ao80wIpV1,,14.0,Twitter for iPhone,https://twitter.com/dog_rates/status/825535076884762624/photo/1,56199.0,19563.0,puppo
825147591692263424,2017-01-28 01:04:51,This is Sweet Pea. She hides in shoe boxes and waits for someone to pick her. Then she surpuprises them. 13/10 https://t.co/AyBEmx56MD,Sweet,13.0,Twitter for iPhone,https://twitter.com/dog_rates/status/825147591692263424/photo/1,20129.0,5223.0,
825026590719483904,2017-01-27 17:04:02,"Say hello to Pablo. He's one gorgeous puppo. A true 12/10. Click the link to see why Pablo requests your assistance

https://t.co/koHvVQp9bL https://t.co/IhW0JKf7kc",Pablo,12.0,Twitter for iPhone,"https://www.gofundme.com/my-puppys-double-cataract-surgery,https://twitter.com/dog_rates/status/825026590719483904/photo/1",6991.0,1477.0,puppo
824775126675836928,2017-01-27 00:24:48,This is Scooter. His lack of opposable thumbs is rendering his resistance to tickling embarrassingly moot. 12/10 would keep tickling https://t.co/F0VWg2GztI,Scooter,12.0,Twitter for iPhone,https://twitter.com/dog_rates/status/824775126675836928/photo/1,16440.0,4042.0,
824663926340194305,2017-01-26 17:02:56,This is Wilson. Named after the volleyball. He tongue wrestled a bee and lost. 13/10 valiant effort tho https://t.co/A5Mx4h1FSM,Wilson,13.0,Twitter for iPhone,https://twitter.com/dog_rates/status/824663926340194305/photo/1,,,
824325613288833024,2017-01-25 18:38:36,Retweet the h*ck out of this 13/10 pupper #BellLetsTalk https://t.co/wBmc7OaGvS,,13.0,Twitter for iPhone,https://twitter.com/dog_rates/status/824325613288833024/photo/1,12961.0,11791.0,pupper
824297048279236611,2017-01-25 16:45:05,This is Nala. She got in trouble. One h*ck of a pupnishment. Still 11/10 would pet https://t.co/EmJbG0skLt,Nala,11.0,Twitter for iPhone,https://twitter.com/dog_rates/status/824297048279236611/photo/1,,,
824025158776213504,2017-01-24 22:44:42,"""I wish we were dogs"" 14/10 for @BadlandsNPS https://t.co/50qq2DItPW",,14.0,Twitter for iPhone,https://twitter.com/badlandsnps/status/823966201328046080,5234.0,675.0,
823939628516474880,2017-01-24 17:04:50,This is Cash. He's officially given pup on today. 12/10 frighteningly relatable https://t.co/m0hrATIEyw,Cash,12.0,Twitter for iPhone,https://twitter.com/dog_rates/status/823939628516474880/photo/1,11712.0,3110.0,
823699002998870016,2017-01-24 01:08:40,This is Winston. The goggles make him a superhero. Protects the entire city from criminals unless they rub his belly really well. 12/10 https://t.co/yCydYURYEL,Winston,12.0,Twitter for iPhone,https://twitter.com/dog_rates/status/823699002998870016/photo/1,13786.0,2764.0,
823581115634085888,2017-01-23 17:20:14,This is Crawford. He's quite h*ckin good at the selfies. Nose is incredibly boopable. 11/10 would snapchat https://t.co/6F5Rrp472U,Crawford,11.0,Twitter for iPhone,https://twitter.com/dog_rates/status/823581115634085888/photo/1,14336.0,3020.0,
823322678127919110,2017-01-23 00:13:17,This is Wyatt. He's got the fastest paws in the West. H*ckin deadly. 11/10 would ride into the sunset with https://t.co/stkJ377KK7,Wyatt,11.0,Twitter for iPhone,https://twitter.com/dog_rates/status/823322678127919110/photo/1,,,
822975315408461824,2017-01-22 01:12:59,This is Albus. He's soaked as h*ck. Seems to have misplaced an ear as well. Still in good spirits tho. 12/10 would dry https://t.co/yUM8jYStuG,Albus,12.0,Twitter for iPhone,https://twitter.com/dog_rates/status/822975315408461824/photo/1,19071.0,3936.0,
822872901745569793,2017-01-21 18:26:02,Here's a super supportive puppo participating in the Toronto  #WomensMarch today. 13/10 https://t.co/nTz3FtorBc,,13.0,Twitter for iPhone,https://twitter.com/dog_rates/status/822872901745569793/photo/1,,,puppo
822859134160621569,2017-01-21 17:31:20,This is Hobbes. He was told he was going to the park. Ended up at the vet. H*ckin bamboozled. Quite pupset with you. 12/10 https://t.co/SSQE06XClS,Hobbes,12.0,Twitter for iPhone,https://twitter.com/dog_rates/status/822859134160621569/photo/1,,,
822610361945911296,2017-01-21 01:02:48,Please stop sending in non-canines like this Very Pettable Dozing Bath Tortoise. We only rate dogs. Only send dogs... 12/10 https://t.co/mcagPeENIh,,12.0,Twitter for iPhone,https://twitter.com/dog_rates/status/822610361945911296/photo/1,16259.0,3409.0,
822489057087389700,2017-01-20 17:00:46,This is Paisley. She really wanted to be president this time. Dreams officially crushed. 13/10 https://t.co/liJGwMp17E,Paisley,13.0,Twitter for iPhone,https://twitter.com/dog_rates/status/822489057087389700/photo/1,,,
822462944365645825,2017-01-20 15:17:01,"This is Gabe. He was the unequivocal embodiment of a dream meme, but also one h*ck of a pupper. You will be missed by so many. 14/10 RIP https://t.co/M3hZGadUuO",Gabe,14.0,Twitter for iPhone,https://twitter.com/dog_rates/status/822462944365645825/photo/1,,,pupper
822244816520155136,2017-01-20 00:50:15,We only rate dogs. Please don't send pics of men capturing low level clouds. Thank you... 11/10 https://t.co/rLi83ZyCL5,,11.0,Twitter for iPhone,https://twitter.com/dog_rates/status/822244816520155136/photo/1,38696.0,11350.0,
821886076407029760,2017-01-19 01:04:45,This is Jimison. He was just called a good boy. 13/10 https://t.co/djMep7mGkV,Jimison,13.0,Twitter for iPhone,https://twitter.com/dog_rates/status/821886076407029760/photo/1,12529.0,2682.0,
821765923262631936,2017-01-18 17:07:18,This is Duchess. She uses dark doggo forces to levitate her toys. 13/10 magical af https://t.co/maDNMETA52,Duchess,13.0,Twitter for iPhone,https://twitter.com/dog_rates/status/821765923262631936/photo/1,9285.0,1893.0,doggo
821522889702862852,2017-01-18 01:01:34,This is Harlso. He has a really good idea but isn't sure you're going to like it. 13/10 he'll just keep it to himself https://t.co/IzcaR3Nqyn,Harlso,13.0,Twitter for iPhone,https://twitter.com/dog_rates/status/821522889702862852/photo/1,,,
821407182352777218,2017-01-17 17:21:47,This is Sundance. He's a doggo drummer. Even sings a bit on the side. 14/10 entertained af (vid by @sweetsundance) https://t.co/Xn5AQtiqzG,Sundance,14.0,Twitter for iPhone,https://twitter.com/dog_rates/status/821407182352777218/video/1,,,doggo
821149554670182400,2017-01-17 00:18:04,This is Luca. He got caught howling. H*ckin embarrassed. 12/10 https://t.co/r8DxA8DYJ2,Luca,12.0,Twitter for iPhone,https://twitter.com/dog_rates/status/821149554670182400/video/1,9678.0,2309.0,
821107785811234820,2017-01-16 21:32:06,Here's a doggo who looks like he's about to give you a list of mythical ingredients to go collect for his potion. 11/10 would obey https://t.co/8SiwKDlRcl,,11.0,Twitter for iPhone,https://twitter.com/dog_rates/status/821107785811234820/photo/1,,,doggo
821044531881721856,2017-01-16 17:20:45,This is Flash. He went way too hard celebrating Martin Luther King Day last night. 12/10 now he's having a dream in his honor https://t.co/bryVdNaRcu,Flash,12.0,Twitter for iPhone,https://twitter.com/dog_rates/status/821044531881721856/photo/1,13974.0,2622.0,
820749716845686786,2017-01-15 21:49:15,Meet Sunny. He can take down a polar bear in one fell swoop. Fr*cken deadly af. 13/10 would pet with caution https://t.co/EMq8Ud6Ze1,Sunny,13.0,Twitter for iPhone,https://twitter.com/dog_rates/status/820749716845686786/photo/1,,,
820690176645140481,2017-01-15 17:52:40,The floofs have been released I repeat the floofs have been released. 84/70 https://t.co/NIYC820tmd,,12.0,Twitter for iPhone,https://twitter.com/dog_rates/status/820690176645140481/photo/1,,,
820314633777061888,2017-01-14 17:00:24,"We are proud to support @LoveYourMelon on their mission to put a hat on every kid battling cancer. They are 14/10

https://t.co/XQlmPTLHPl https://t.co/ZNIkkHgtYE",,14.0,Twitter for iPhone,"https://www.loveyourmelon.com/pages/ourstory,https://twitter.com/dog_rates/status/820314633777061888/photo/1",3696.0,646.0,
820078625395449857,2017-01-14 01:22:35,I've never wanted to go to a camp more in my entire life. 12/10 for all on board https://t.co/wJZlpGFEbD,,12.0,Twitter for iPhone,https://twitter.com/dog_rates/status/820078625395449857/photo/1,,,
819952236453363712,2017-01-13 17:00:21,"This is Oliver. He has dreams of being a service puppo so he can help his owner. 13/10 selfless af

make it happen:
https://t.co/f5WMsx0a9K https://t.co/6lJz0DKZIb",Oliver,13.0,Twitter for iPhone,"https://www.gofundme.com/servicedogoliver,https://twitter.com/dog_rates/status/819952236453363712/photo/1",5903.0,1361.0,puppo
819924195358416896,2017-01-13 15:08:56,Here we have a doggo who has messed up. He was hoping you wouldn't notice. 11/10 someone help him https://t.co/XdRNXNYD4E,,11.0,Twitter for iPhone,https://twitter.com/dog_rates/status/819924195358416896/video/1,14243.0,5576.0,doggo
819711362133872643,2017-01-13 01:03:12,This is Howie. He just bloomed. 11/10 revolutionary af https://t.co/m5fYxrO3IU,Howie,11.0,Twitter for iPhone,https://twitter.com/dog_rates/status/819711362133872643/photo/1,,,
819588359383371776,2017-01-12 16:54:26,This is Jazzy. She just found out that sandwich wasn't for her. Shocked and puppalled. 13/10 deep breaths Jazzy https://t.co/52cItP0vIO,Jazzy,13.0,Twitter for iPhone,https://twitter.com/dog_rates/status/819588359383371776/photo/1,10556.0,2259.0,
819347104292290561,2017-01-12 00:55:47,Say hello to Anna and Elsa. They fall asleep in similar positions. It's pretty wild. Both 12/10 would snug simultaneously https://t.co/8rUL99bX4W,Anna,12.0,Twitter for iPhone,https://twitter.com/dog_rates/status/819347104292290561/photo/1,,,
819227688460238848,2017-01-11 17:01:16,This is Finn. He's wondering if you come here often. Fr*ckin flirtatious af. 12/10 would give number to https://t.co/ii5eNX5LJT,Finn,12.0,Twitter for iPhone,https://twitter.com/dog_rates/status/819227688460238848/photo/1,25548.0,7694.0,
819006400881917954,2017-01-11 02:21:57,This is Sunny. She was also a very good First Doggo. 14/10 would also be an absolute honor to pet https://t.co/YOC1fHFCSb,Sunny,14.0,Twitter for iPhone,https://twitter.com/dog_rates/status/819006400881917954/photo/1,,,doggo
819004803107983360,2017-01-11 02:15:36,This is Bo. He was a very good First Doggo. 14/10 would be an absolute honor to pet https://t.co/AdPKrI8BZ1,,14.0,Twitter for iPhone,https://twitter.com/dog_rates/status/819004803107983360/photo/1,95138.0,42045.0,doggo
818627210458333184,2017-01-10 01:15:10,Meet Wafer. He represents every fiber of my being. 13/10 very good dog https://t.co/I7bkhxBxUG,Wafer,13.0,Twitter for iPhone,https://twitter.com/dog_rates/status/818627210458333184/photo/1,24481.0,8527.0,
818614493328580609,2017-01-10 00:24:38,This is Bear. He's a passionate believer of the outdoors. Leaves excite him. 12/10 would hug softly https://t.co/FOF0hBDxP8,Bear,12.0,Twitter for iPhone,https://twitter.com/dog_rates/status/818614493328580609/photo/1,,,
818536468981415936,2017-01-09 19:14:36,This is Tom. He's a silly dog. Known for his unconventional swing style. One h*ck of a sneaky tongue slip too. 11/10 would push https://t.co/6fSVcn9HAU,Tom,11.0,Twitter for iPhone,https://twitter.com/dog_rates/status/818536468981415936/photo/1,12086.0,2864.0,
818259473185828864,2017-01-09 00:53:55,This is Florence. He saw the same snap you sent him on your story. Pretty pupset with you. 12/10 https://t.co/rnkvT2kvib,Florence,12.0,Twitter for iPhone,https://twitter.com/dog_rates/status/818259473185828864/photo/1,12163.0,2611.0,
818145370475810820,2017-01-08 17:20:31,This is Autumn. Her favorite toy is a cheeseburger. She takes it everywhere. 11/10 https://t.co/JlPug12E5Z,Autumn,11.0,Twitter for iPhone,https://twitter.com/dog_rates/status/818145370475810820/photo/1,,,
817908911860748288,2017-01-08 01:40:55,"Looks like he went cross-eyed trying way too hard to use the force. 12/10 
https://t.co/bbuKxk0fM8",,12.0,Twitter for iPhone,https://twitter.com/micahgrimes/status/817902080979599361,5337.0,902.0,
817827839487737858,2017-01-07 20:18:46,This is Buddy. He ran into a glass door once. Now he's h*ckin skeptical. 13/10 empowering af (vid by Brittany Gaunt) https://t.co/q2BgNIi3OA,Buddy,13.0,Twitter for iPhone,https://twitter.com/dog_rates/status/817827839487737858/video/1,,,
817777686764523521,2017-01-07 16:59:28,"This is Dido. She's playing the lead role in ""Pupper Stops to Catch Snow Before Resuming Shadow Box with Dried Apple."" 13/10 (IG: didodoggo) https://t.co/m7isZrOBX7",Dido,13.0,Twitter for iPhone,https://twitter.com/dog_rates/status/817777686764523521/video/1,,,"doggo,pupper"
817536400337801217,2017-01-07 01:00:41,"Say hello to Eugene &amp; Patti Melt. No matter how dysfunctional they get, they will never top their owners. Both 12/10 would pet at same time https://t.co/jQUdvtdYMu",Eugene,12.0,Twitter for iPhone,https://twitter.com/dog_rates/status/817536400337801217/photo/1,,,
817423860136083457,2017-01-06 17:33:29,This is Ken. His cheeks are magic. 13/10 (IG: ken_shiba) https://t.co/btzf1zTDeQ,Ken,13.0,Twitter for iPhone,https://twitter.com/dog_rates/status/817423860136083457/video/1,,,
817415592588222464,2017-01-06 17:00:38,"Meet Strudel. He's rather h*ckin pupset that your clothes clash. 11/10 click the link to see how u can help Strudel

https://t.co/3uxgLz8d0l https://t.co/O0ECL1StB2",Strudel,11.0,Twitter for iPhone,"https://www.gofundme.com/help-strudel-walk-again?rcid=ec2be8b6f825461f8ee0fd5dcdf43fea,https://twitter.com/dog_rates/status/817415592588222464/photo/1",6234.0,1122.0,
817171292965273600,2017-01-06 00:49:53,This is Tebow. He kindly requests that you put down the coffee and play with him. 13/10 such a good boy https://t.co/56uBP28eqw,Tebow,13.0,Twitter for iPhone,https://twitter.com/dog_rates/status/817171292965273600/photo/1,9650.0,2315.0,
817120970343411712,2017-01-05 21:29:55,Name a more iconic quartet... I'll wait. 13/10 for all https://t.co/kCLgD8687T,,13.0,Twitter for iPhone,https://twitter.com/dog_rates/status/817120970343411712/photo/1,13331.0,3004.0,
817056546584727552,2017-01-05 17:13:55,This is Chloe. She fell asleep at the wheel. Absolute menace on the roadways. Sneaky tongue slip tho. 11/10 https://t.co/r6SLVN2VUH,Chloe,11.0,Twitter for iPhone,https://twitter.com/dog_rates/status/817056546584727552/photo/1,9489.0,1916.0,
816816676327063552,2017-01-05 01:20:46,This is Timber. He misses Christmas. Specifically the presents part. 12/10 cheer pup Timber https://t.co/dVVavqpeF9,Timber,12.0,Twitter for iPhone,https://twitter.com/dog_rates/status/816816676327063552/photo/1,11030.0,2350.0,
